id,date,title,content
20190506_00,20190506,习近平就俄罗斯一架客机紧急迫降造成重大人员伤亡向俄罗斯总统普京致慰问电,国家主席习近平5月6日就俄罗斯一架客机在莫斯科谢列梅捷沃机场紧急迫降时起火造成重大人员伤亡向俄罗斯总统普京致慰问电。习近平在慰问电中表示，惊悉贵国一架客机在莫斯科谢列梅捷沃机场紧急迫降时起火，造成重大人员伤亡和财产损失。我谨代表中国政府和中国人民，并以我个人的名义，对遇难者表示沉痛的哀悼，向受伤者和遇难者家属致以诚挚慰问。
20190506_01,20190506,李克强向俄罗斯总理梅德韦杰夫致慰问电,5月6日，国务院总理李克强也就此向俄罗斯总理梅德韦杰夫致慰问电，向遇难者表示哀悼，向伤者和遇难者家属表示慰问。
20190506_02,20190506,俄罗斯一客机迫降烧毁 41人遇难,俄罗斯官方机构5日表示，当天在莫斯科谢列梅捷沃机场一架客机发生迫降和起火事故，机上共载有78人，其中41人遇难，37人生还。当地时间5日17时50分，这架隶属于俄罗斯国际航空公司的苏霍伊超级100型客机，从谢列梅捷沃机场起飞后不久，飞行员向地面请求迫降。客机着陆时飞机左侧机翼剧烈燃烧，一些乘客在飞机尚在滑行时即从机舱跳出。飞机停稳后机身后部着火，机身前部两侧的逃生滑梯供部分乘客逃离。事故飞机的机组人员表示，飞机在飞行时被闪电击中，导致机上无线电设备出现故障。俄罗斯总统普京已经下令对飞机迫降事故原因进行最全面的调查。目前事故客机的黑匣子已经找到，俄联邦侦查委员会已对此展开犯罪调查。俄罗斯紧急情况部今天（5月6日）表示，没有计划停飞涉事机型——苏霍伊超级100型客机。
20190506_03,20190506,【壮丽70年 奋斗新时代】云南：独龙江畔 一跃千年,习近平总书记曾在不同场合多次强调，全面实现小康，一个民族都不能少！高山峡谷中的独龙族人民，长期与世隔绝，他们的贫困曾经延续千年，习总书记一直牵挂着他们。近年来，习总书记和独龙族干部群众的直接交集就有三次。今天的“壮丽70年 奋斗新时代”，一起来看一个世代刀耕火种的民族，如何摆脱贫穷，实现“千年一跃”。独龙江乡位于云南西北部，海拔在1200米至5000米之间。全国仅约7000人的独龙族，有4200多人聚居在这里，因为自然条件恶劣，这里是云南乃至全国最为贫穷的地区之一。习近平总书记一直惦念着这里。2014年高黎贡山隧道通车，2018年独龙族整族脱贫，两件喜事，习总书记两次回信，勉励乡亲们。独龙江乡地处横断山脉腹地，直到新中国成立前，独龙族仍处于原始社会末期。新中国成立后，独龙族从原始社会迈入社会主义社会，迎来了民族命运的转折点。党和政府还开辟了翻越高黎贡山的人马驿道，连通了独龙族和外面的世界。39岁的龙元村村民和晓永，曾在这条路上跑过一年多的马帮，从村里到县城，来回要走12天。在党和政府的关怀下，独龙江公路开建，2014年元旦前夕，乡亲们给习总书记写信，报告了高黎贡山隧道即将贯通的消息，总书记回信说：希望乡亲们早日过上小康生活。2015年1月，正在云南考察的习近平总书记，亲切会见了独龙族干部群众代表，并强调“全面实现小康，一个民族都不能少！”。近年来，国家投入13亿多元，实施基础设施、安居工程、特色产业等六大工程，推动独龙族加快发展。曾经跑马帮的和晓永又跑起了运输。现在，独龙江乡6个行政村、26个自然村都通了公路。随着交通迭代升级，从原始社会走来的古老民族加快融入现代文明。如今，独龙族有了绿色生态的现代产业，独龙江两岸的林下经济初具规模。仅草果一项，种植面积已经达到6.8万亩。党的十八大以来，脱贫攻坚力度不断加大。目前独龙江乡1136户独龙族群众全部住上了宽敞舒适的安居房，以前世代居住的低矮破旧的茅草房、木楞房，已经难觅踪影。2018年底，随着独龙江乡最后一个贫困村迪政当村脱贫，独龙族家家住上安居房，人人都有社会保障，摆脱了世代贫困，实现“一步跨千年”。今年4月10日，习近平总书记给独龙江乡群众回信，祝贺独龙族整族脱贫，勉励乡亲们“同心协力建设好家乡、守护好边疆，努力创造独龙族更加美好的明天”。
20190506_04,20190506,李克强主持召开国务院常务会议,国务院总理李克强5月5日主持召开国务院常务会议，明确政策举措力争今年底前基本取消全国高速公路省界收费站，便利群众出行提高物流效率；部署以制度创新持续减少和规范证明事项，进一步优化政务服务和营商环境；听取职业病防治工作汇报，要求更有力保障职工健康权益。为落实党中央、国务院深化收费公路改革部署，将《政府工作报告》提出的两年内基本取消全国高速公路省界收费站的任务提前至力争今年底实现，减轻消费者负担和企业成本、扩大有效需求，会议确定，一是提高我国高速公路现代化水平，推广电子不停车快捷收费系统，争取年底实现全国高速公路入口车辆普遍使用。相关部门要协同配合、优化服务，方便群众就近便捷免费安装不停车快捷收费系统。二是在不增加货车通行费总体负担情况下，优化货车通行费计费方式。对封闭式高速公路收费站入口同步实行不停车称重。三是探索经验，完善相关制度和政策，推进修订法律法规。优化鲜活农产品运输“绿色通道”等减免费政策。妥善做好收费人员分流安置，做到转岗不下岗。会议指出，近年来各地区各部门深化“放管服”改革，大幅削减证明事项，优化了营商环境。下一步，要继续梳理取消证明事项，对保留事项实行清单管理，推进建立证明事项告知承诺制。会议决定，在天津、辽宁等13个省（市）和公安部、司法部等5个部门开展试点。申请人在申请办理行政许可、行政确认等事项时，由行政机关以书面形式一次性告知规定的证明义务和内容，在申请人书面承诺符合条件并愿意承担不实承诺的法律责任后，行政机关不再索要证明，依据承诺办理相关事项，并通过联网核查等加强事中事后监管。建立申请人诚信档案和黑名单制度，对提供虚假承诺等实行失信联合惩戒，鼓励守法诚信经营，夯实社会信用基础。会议听取了职业病防治工作汇报，要求聚焦主要病种尘肺病，在矿山、建材等行业开展粉尘危害整治，加强监管执法。全面强化预防，督促企业改进工艺和设备、配备个体防护用品、为员工办理工伤保险，坚决减少新发病例。加大职业病专项经费投入，对患者实施分类救治，研究运用工伤保险、医疗救助等手段加强兜底保障。
20190506_05,20190506,李克强签署国务院令 公布《报废机动车回收管理办法》,国务院总理李克强日前签署国务院令，公布《报废机动车回收管理办法》，自2019年6月1日起施行。国务院2001年6月16日公布的《报废汽车回收管理办法》同时废止。
20190506_06,20190506,汪洋主持召开全国政协第二十次主席会议,政协第十三届全国委员会第二十次主席会议6日在京举行，中共中央政治局常委、全国政协主席汪洋主持会议并讲话。会议审议并原则通过了政协全国委员会庆祝人民政协成立70周年活动方案。汪洋强调，庆祝人民政协成立70周年是全国政协今年的一项重要政治任务，要认真梳理、总结和继承人民政协70年光辉历程凝聚的政治智慧和实践经验，将庆祝活动与今年各项工作有效衔接、融会贯通，进一步发挥好人民政协作为专门协商机构的作用，推动人民政协制度更加成熟更加定型，为实现“两个一百年”奋斗目标、实现中华民族伟大复兴的中国梦作出更大的贡献。要充分发挥委员在政协工作中的主体作用，充分调动各方面的积极性，使庆祝活动成为委员们学习政协理论、了解政协历史、进行自我教育、增进思想共识、凝聚奋进力量的过程。会议审议通过了全国政协十三届常委会第七次会议议程（草案）和日程，决定会议于6月17日至19日在京召开，主要议题是围绕“推动制造业高质量发展”协商建言。会议审议通过关于免去陈进行政协第十三届全国委员会社会和法制委员会副主任职务的决定，提请第七次常委会会议追认。会议还听取了关于全国地方政协工作经验交流会筹备工作情况的汇报。围绕中国探月工程相关内容进行了主席会议2019年第二次集体学习，十三届全国政协常委、中国工程院院士、中国探月工程总设计师吴伟仁作了讲解。全国政协副主席兼秘书长夏宝龙等分别就有关议题作了说明和汇报。
20190506_07,20190506,汪洋参观西藏民主改革60周年专题展览,中共中央政治局常委、全国政协主席汪洋近日来到北京西藏文化博物馆，参观“废奴丰碑——西藏民主改革60周年特展”。汪洋指出，60年前西藏废除了政教合一的封建农奴制度，是西藏历史上最伟大、最深刻、最有进步意义的社会变革。60年来特别是党的十八大以来，西藏社会生产力得到极大解放，群众生活水平不断提高，优秀传统文化得到有效保护和弘扬，宗教信仰自由得到充分保障。历史雄辩地证明，没有民主改革，就没有西藏广大劳动人民翻身得解放，就没有西藏各族人民的幸福生活。汪洋强调，西藏今天的大好局面来之不易，务必倍加珍惜。要坚持中国共产党领导，坚持社会主义制度，坚持民族区域自治制度，在习近平新时代中国特色社会主义思想指引下，不断开创西藏繁荣发展和长治久安的新局面，使雪域高原更加安定祥和、各族人民更加幸福安康。尤权等一起参观展览。“废奴丰碑——西藏民主改革60周年特展”以500余幅图片、48件实物及虚拟多媒体等技术，全方位、立体式呈现了西藏民主改革60年来的光辉历程，深刻揭露了旧西藏政教合一封建农奴制的黑暗，全面揭示了1959年西藏反动上层发动武装叛乱的历史真相，生动展示了60年来西藏翻天覆地的变化，特别是党的十八大以来以习近平同志为核心的党中央对西藏的关心和西藏经济社会发展取得的显著成就。
20190506_08,20190506,中办 国办印发《法治政府建设与责任落实督察工作规定》,近日，中共中央办公厅、国务院办公厅印发了《法治政府建设与责任落实督察工作规定》，并发出通知，要求各地区各部门认真遵照执行。《法治政府建设与责任落实督察工作规定》共有六章35条，该规定由中央全面依法治国委员会办公室负责解释，自2019年4月15日起施行。
20190506_09,20190506,【在习近平新时代中国特色社会主义思想指引下——新时代 新作为 新篇章】人民公安：忠诚铸警魂 担当护平安,对党忠诚、服务人民、执法公正、纪律严明是新时代公安队伍建警治警的总方略。全国公安机关和广大民警恪尽职守，勇于担当，在打击犯罪、服务群众的一线奋发作为，使中国成为世界公认的最安全地区之一。这里是杭州扫黑除恶侦查研判中心，在评估作战形势的大屏上，实时滚动着110接处警平台的最新警情。民警发现拱墅区祥符派出所辖区一度警情高发。从新业态、新领域中发现新型黑恶犯罪，凭借智慧警务平台和人工智能城市大脑的分析研判，民警只用了一个多月，就从海量数据中搜寻出16个套路贷团伙的犯罪证据。智慧警务使公安机关打击犯罪变得更加精准高效。抓住人民群众反映强烈的突出问题，各地公安机关扫黑除恶向纵深推进；打击传统“盗抢骗”等多发性侵财犯罪和黄赌毒等社会丑恶现象持续发力；打击电信网络诈骗犯罪，“缉枪”“治爆”“净网”攻势凌厉，同时剑指非法集资、金融诈骗等风险型经济犯罪。一系列专项行动有力遏制了突出违法犯罪高发态势。人民公安为人民，就要从让人民群众满意的事情做起。在全面深化公安改革中，公安现役部队改革、国家移民管理体制改革等各项改革推进有力。在深化放管服改革中，公安机关简政放权、承诺办理护照等出入境证件“只跑一次”、交管审批业务推行“马上办、网上办、就近办、一次办”。在重庆市涪陵区义和镇，村民张师傅在当地镇上就完成了摩托车的年审上线检测服务。翻开公安改革的工作清单，一个词语在不同领域高频度出现：“异地”。在全国范围内，居民身份证异地受理、挂失申报和丢失招领，车辆跨省异地检验，驾驶证异地申领换领补领，交通违法罚款跨省异地缴纳，内地居民可异地补换发出入境证件……短短数年间，公安改革含金量充分释放。中国公民人均通关查验时间减少至45秒。驾驶证、机动车登记业务办理时间减少50%，异地办理居民身份证累计2000多万张。忠诚，是融入血脉的人民警察之魂。2018年最后一天，福建南平交警刘才添在结冰的高速路面执勤时，一辆重型牵引车打滑冲入现场，刘才添在最后一刻奋力推开两名群众，却将28岁的生命定格在他守护的高速路上。在朋友圈里，他留下了这样的话语：生活不止眼前的苟且，还有诗和远方的田野，赤手空拳来到人世间，为找到那片海不顾一切。刘才添心中的那片海就是200万人民警察用生命守护的平安中国。据最新统计，仅2013年至2018年的6年里，全国公安民警因公牺牲2306人，因公负伤3.2万人。
20190506_10,20190506,第二届数字中国建设峰会在福州市开幕,第二届数字中国建设峰会6日上午在福建省福州市开幕。峰会由国家互联网信息办公室、国家发展和改革委员会、工业和信息化部、福建省人民政府共同举办。峰会定位是我国信息化发展政策发布平台、电子政务和数字经济发展成果展示平台、数字中国建设理论经验和实践交流平台、汇聚全球力量助推数字中国建设合作平台。本届峰会围绕“以信息化培育新动能，用新动能推动新发展，以新发展创造新辉煌”主题，来自各省区市和新疆生产建设兵团有关部门负责人、行业组织负责人、产业界代表、专家学者以及智库代表等约1500人出席峰会。多位知名专家和企业家在主论坛发表演讲。各界嘉宾就党的十九大以来，建设网络强国、数字中国和智慧社会等重要议题畅谈创新实践，分享建设经验，互学互鉴，共话未来。科技创新和产业发展氛围浓厚。
20190506_11,20190506,全国人大常委会启动就业促进法执法检查,为全面了解就业促进法的实施情况，督促解决法律实施中存在的突出矛盾和问题，进一步贯彻落实法律有关制度和规定，全国人大常委会启动就业促进法执法检查。记者从6日在北京召开的全国人大常委会就业促进法执法检查组第一次全体会议上了解到，检查组将于5月至6月，分赴内蒙古、江西、山东、广东、云南、甘肃6个省（区）进行检查，同时委托天津、辽宁、江苏、浙江、安徽、河南、湖北、广西、重庆、贵州等10个省（区、市）人大常委会分别对本行政区域内就业促进法的实施情况进行检查。
20190506_12,20190506,西北华南等地强降雨 北方气温将回升,立夏当天，我国西北地区东部、华南等地仍然持续降雨降温天气。在陕西秦岭主峰太白山，今天（5月6日）凌晨开始下起了大雪，积雪厚度达15CM。景区已经启动了应急预案，安排人员清扫积雪。在甘肃武威，持续的降雨降温天气，给市民出行和道路交通造成了影响，交警部门全员上岗，疏导交通，保障市民安全出行。在江西信丰，昨天（5月5日）晚上开始的大雨，最大降雨量达79.4毫米，持续降雨造成河道水位上涨，城区公园、绿道被淹，市政部门在附近拉起警戒线，设立提示牌，保障安全。预计未来三天，华南、西北地区东部等地仍有降雨，但强度将有所减弱。从今天（5月6日）开始，随着冷空气影响减弱，北方地区气温将回升，京津冀等地最高气温将重新回升至30℃左右。
20190506_13,20190506,国内联播快讯,41家境外经纪机构参与我国铁矿石期货我国铁矿石期货正式引入境外交易者一年来，运行平稳。截至目前，已有41家境外经纪机构在大连商品交易所备案开展转委托业务，为新加坡、英国、澳大利亚等12个国家和地区的125个境外客户提供金融服务。全球央行黄金储备持续增加世界黄金协会最新数据显示，截至2019年3月，全球官方黄金储备共计33976.5吨。其中美国、德国、意大利、法国、瑞士、日本、荷兰等国的储量没有变化；俄罗斯黄金储备由2150.5吨增至2168.3吨，中国由1874.3吨增至1885.5吨。5月15日起对农村商业银行定向降准中国人民银行决定从5月15日开始，对仅在本县级行政区域内经营，或在其他县级行政区域设有分支机构但资产规模小于100亿元的农村商业银行，执行与农村信用社相同档次8%的存款准备金率。约有1000家农商行可以享受该项优惠政策，可释放长期资金约2800亿元，将全部用于发放民营和小微企业贷款。珠三角水资源配置工程开工建设珠三角水资源配置工程今天（5月6日）开工建设。工程西起西江干流佛山顺德的鲤鱼洲，东至深圳公明水库，中间以深层管道输水方式穿越粤港澳大湾区核心城市群。建成后将解决广州南沙、东莞、深圳的缺水问题，同时可为香港等地提供应急备用水源。重庆铁山峰隧道今天贯通今天（5月6日），重庆万开快速通道控制性工程——铁峰山隧道顺利贯通。万开快速通道全长11.6公里，设计时速80公里，预计今年底全线通车，届时重庆万州至开州的车程将由1小时缩短至15分钟。全球最大吨位全地面起重机首吊成功我国自主研制的全球最大吨位全地面起重机--徐工1600吨9桥起重机，今天（5月6日）在河北柏乡风电场首次完成高达140米风电安装，实现了作业效率和起重性能的新突破。此前国际最大吨位全地面起重机为1200吨。无人机拍到帕米尔盘羊种群最近，新疆塔什库尔干野生动物自然保护区工作人员用无人机监测到上百只帕米尔盘羊种群栖息活动的影像。帕米尔盘羊主要生活在海拔1500米至5500米左右的高寒山区，最重可达250公斤，属国家二级保护动物。
20190506_14,20190506,委内瑞拉举行全国对话大会,5日，委内瑞拉为期两天的全国对话大会落幕。委内瑞拉主要政府官员与民众代表就相关问题进行了讨论和交流。此外， 5日委内瑞拉外长阿雷亚萨访问俄罗斯，并与俄罗斯外长拉夫罗夫举行会谈。这次委内瑞拉全国性对话为期两天，在委内瑞拉全境超过2500个社区举行，旨在有效推动变革，缓解国内危机。委内瑞拉政府的主要官员、各州代表、州长和市长、各行业代表分别进行了讨论，对话大会的话题集中在维护和平、推动经济发展、主权独立、司法公正、领土防卫等方面，具体为还涉及各州如何打击官僚主义和贪腐问题，以及针对4月30日未遂“政变”的调查裁决等。按计划，最终讨论结果将递交给委内瑞拉总统马杜罗作为参考。俄罗斯外交部长拉夫罗夫5日在莫斯科与到访的委内瑞拉外长阿雷亚萨举行会见后表示，俄方坚定支持委内瑞拉总统马杜罗领导的合法政府。拉夫罗夫说，当前美国正策动旨在推翻委内瑞拉合法政权的行动，这一行动极其粗暴地破坏了根据联合国宪章确立的所有国际法准则。俄方对此予以谴责。拉夫罗夫说，俄方坚决呼吁不干涉别国内部事务，并认为委内瑞拉人民有权决定本国命运，为此委内瑞拉国内各方需开展包容性对话。阿雷亚萨在会谈结束后对媒体说，委方感谢俄政府支持维护委内瑞拉国家主权，对话是解决国内危机的唯一途径。
20190506_15,20190506,国际联播快讯,阿富汗一警局总部遭塔利班袭击阿富汗北部巴格兰省警察总部5日遭到袭击，导致18名警察死亡，另有55人受伤。巴格兰省安全官员说，多名袭击者闯入警察总部，袭击者随后引爆爆炸装置并与安全部队发生交火，8名袭击者都被警方击毙。阿富汗塔利班当天宣称制造了这起袭击事件。近期，阿富汗安全部队与塔利班武装的冲突不断加剧。巴官员称巴以就冲突达成停火协议巴勒斯坦官员6日表示，巴勒斯坦和以色列已就停止加沙地带的冲突达成协议。巴勒斯坦官员说，停火协议于当地时间6日凌晨生效。以色列军方已经解除了边境地区的道路封锁，公共交通已经恢复。不过以色列官方没有对停火一事发表评论。3日，巴以双方在加沙地带爆发新一轮冲突，造成双方20多人死亡、超过200人受伤。爆炸袭击后 斯里兰卡学校复课斯里兰卡全国的公立学校定于6日复课，最近几天，斯里兰卡警方加紧在国内进行安全排查工作。5日在首都科伦坡的一所中学，斯里兰卡军警出动警犬、对包括门窗在内的设施进行了细致的安全检查。校方表示，校园里学生的安全可以得到保障。斯里兰卡4月21日发生多起爆炸，致使250多人死亡，500多人受伤。随后全国大部分学校暂时停课。极端组织宣称发动了这些袭击。目前仍有与爆炸袭击有关的约约25人至30人在逃。
