id,date,title,content
20190511_05,20190511,北京冬奥会筹备工作稳步推进,昨天（10日），北京迎来2022年冬奥会倒计时1000天。目前，各项筹备工作正稳步推进。昨晚（10日），北京冬奥会倒计时1000天活动在奥林匹克公园举行。北京冬奥组委发布《北京2022年冬奥会和冬残奥会志愿服务行动计划》，正式启动冬奥志愿服务工作。按计划，北京冬奥会赛会志愿者计划招募2.7万人，冬残奥会志愿者计划招募1.2万人。共设立前期志愿者项目、测试赛志愿者项目等5个志愿服务项目，将于2019年12月正式启动。今天（11日）上午，河北省在张家口举办“冬奥就在我身边”主题系列活动，包含“全民上冰雪 助力冬奥会”冰雪运动进社区等内容。目前，张家口正抓紧细化赛事的医疗等保障服务方案，筹办工作进入攻坚冲刺阶段。一系列服务冬奥的基础设施建设也在稳步推进，延崇高速玉渡山隧道和松山隧道目前进入最后冲刺阶段，计划今年底通车，届时北京到崇礼的车程将由现在的4小时缩短至1小时。据了解，北京2022冬奥会践行绿色办奥理念，场馆将100%使用清洁能源供电。国家电网将高标准、高质量建设好冬奥配套电网工程。
20190511_06,20190511,【多彩亚洲】精华荟萃 多项主题活动陆续举行,亚洲文明对话大会将于5月15日在北京开幕。汇聚亚洲文明精华，搭建交流互鉴平台，多个各具特色的主题活动陆续展开。在国家图书馆，“甲骨文记忆展”和“《永乐大典》文献展”正在展出。观众可以探寻甲骨文的起源，并近距离观赏国家图书馆的“镇馆之宝”之一——《永乐大典》，这次展出原件中的12册，是近年来最大规模的一次。《永乐大典》是世界文化史上规模最大、内容最广的百科全书。作为“亚洲文明联展”的分展，“东西文明交汇的阿富汗国家宝藏”日前在清华大学艺术博物馆展出。这是在战火中劫后余生的231件阿富汗国家博物馆馆藏珍宝，首次进入中国的大学博物馆。近些年，战争等因素导致阿富汗文物遭受到不同程度的损毁。2001年，有着1500多年历史的巴米扬大佛被塔利班组织炸毁，成为世界文明史上的一大悲剧。为了更好的交流文物修复和保护的成长经验，2018年，敦煌研究院成立了一支8人团队，赴阿富汗考察。考察结束后，敦煌石窟保护研究基金会启用了“人才培养专项基金”，用于对巴米扬地区的青年人才培养教育。一年多以来，敦煌研究院已经帮助三名巴米扬大学的师生完成了文物修复技能的培训。而对于非遗爱好者来说，国家图书馆的《文明匠心 亚洲非遗大展》正在布展中，亚洲各国非遗手工艺术精品将集中亮相，体现亚洲手工匠人的“匠心”。正在布展的还有即将在国家博物馆展出的“大美亚细亚 亚洲文明展”，包括中国在内的亚洲47个国家以及希腊、埃及两个文明古国伙伴，共400多件（组）精美文物藏品将纷纷亮相，规模空前。为迎接亚洲文明对话大会的到来，亚洲美食节也将在中国多地举行。届时，来自泰国、新加坡、日本等多个亚洲国家的美食，将与中国传统美食一起，让人们品味舌尖上的亚洲。
20190511_07,20190511,国内联播快讯,2019年居民医保人均财政补助提高近日，国家医疗保障局会同财政部制定印发通知，明确2019年居民医保人均财政补助标准新增30元，达到每人每年不 低于520元，新增财政补助中15元用于提高大病保险保障能力，同时要求个人缴费相应提高。京津冀蒙跨区域就业创业招聘会举行由中华全国总工会联合北京、天津、河北、内蒙古主办的2019跨区域大型人才招聘会今天（11日）在内蒙古呼和浩特 市举行。招聘会共有1562家企业参加，提供涉及金融、能源、通讯、教育等30多个行业的32830个就业岗位。北极圈论坛中国分论坛今天闭幕由自然资源部主办的北极圈论坛中国分论坛今天（11日）闭幕，论坛以“中国与北极”为主题，围绕冰上丝绸之路、 科学与创新、可持续发展、海洋、能源、治理等议题展开深入交流。来自中国、冰岛、挪威、日本等国家的北极大使 、专家学者等约500人与会。纪录片《亚洲 文明之光》明天起播出由中央广播电视总台制作的三集主题纪录片《亚洲 文明之光》将从明天（12日）起在央视多个频道播出。该片讲述亚 洲文明悠久灿烂、多元共生、交流互鉴的脉络图景，探寻亚洲各古文明和多个文明圈发展轨迹所揭示的规律与智慧， 充分展示亚洲文明的悠久历史，多样风采和独特魅力。联勤保障部队护理备战练兵比武联勤保障部队护理备战练兵比武活动，近日在某综合训练基地进行。比武设置了战场急救、治疗护理等多个课目，分 级分类考核30多项实战环境紧急施救技能，进一步检验护理人员岗位练兵成果。我国在南海海域发现多种稀有鲸豚历时14天、总航程约2500公里的“2019年中科院南海深潜鲸类科考”航次昨天（10日）返回三亚。科考队员一共目击 到深潜和远海性鲸类动物27群次，发现和记录了抹香鲸、喙鲸、条纹海豚等多种稀有鲸豚种群，其中可确定的深潜鲸 类物种4种，远海性海豚物种3种。
20190511_08,20190511,文明交流互鉴促进多样文明繁荣发展,多国文化官员和学者表示，亚洲文明对话大会将搭建起交流对话的开放平台，让各国从不同文明中寻求智慧、汲取营养，携手解决人类共同面临的各种挑战。对于即将举办的亚洲文明对话大会，多个国家的文化官员表示，习近平主席倡导的“文明交流互鉴”，将推动不同文明之间的相互尊重、和谐共处，增进各国人民的友谊与合作。还有一些国家的学者和官员指出，文明与文明之间的对话，有助于解决人类生存和发展的各种问题，是推动世界和平发展的重要动力。
20190511_09,20190511,古特雷斯：多边对话与合作至关重要,联合国秘书长古特雷斯10日在世界贸易组织总理事会特别会议上强调，贸易冲突没有赢家只有输家，通过多边对话与合作解决贸易冲突至关重要。古特雷斯表示，全球化不仅使不同国家、企业和民众间的相互依赖比以往更加深入，也为增长和发展创造了巨大机遇。通过参与全球经济，很多发展中国家实现了经济快速发展，并缩小了与发达经济体间的差距；而参与全球贸易也提高了发展中地区的工资收入水平，让数十亿人摆脱极端贫困。但古特雷斯同时警告，让全球化成为可持续发展积极动力的努力正面临严峻挑战。古特雷斯强调，继续通过多边对话与合作解决贸易冲突至关重要。他指出，一个“以规则为基础的、非歧视的和平等的”贸易体系符合所有贸易伙伴的利益。
20190511_10,20190511,国际联播快讯,叙伊德利卜省南部等地局势紧张10日，叙利亚政府军与反政府武装在伊德利卜省南部发生冲突，局势骤然紧张。同一天，叙反政府武装对哈马省北部郊区一个据点展开反扑行动，企图夺回已经被叙政府军收复的据点，叙政府军对反政府武装发动了猛烈炮击和空袭，最终击退了反政府武装的反扑。目前，叙政府军已收复全国绝大部分地区，反政府武装控制区域仅剩伊德利卜省和哈马省部分地区。安理会呼吁利比亚冲突各方停火10日，联合国安理会就利比亚局势召开会议。安理会成员呼吁利比亚冲突各方停火，重回联合国框架下的政治解决方案。安理会还对利比亚人道主义状况恶化表示关切。控制利比亚东部的“国民军”上月起对利比亚首都的黎波里发起军事行动，与控制该市的利比亚民族团结政府军队交战。根据联合国的数字，自利比亚上月开始冲突升级后，已造成超过440人死亡，上万人流离失所。俄外长：俄日就和平条约问题仍存分歧俄罗斯外交部长拉夫罗夫10日与到访的日本外相河野太郎举行会谈。拉夫罗夫在会谈后说，俄日领导人已经商定依据1956年签署的《苏日共同宣言》加快俄日缔结和平条约谈判进程。俄日双方当天就此展开磋商，但这仍是一个困难的任务。拉夫罗夫还表示，美国在日本境内部署全球导弹防御系统、强化地区军事存在这些都被俄方视为威胁。河野太郎说，日俄双方未能就和平条约问题化解分歧。但双方都认为需就此展开长期磋商。委内瑞拉重新开放部分边境10日，委内瑞拉部长理事会经济事务副主席和生产部长艾萨米宣布，从当天起重新开放与巴西的边境，以及该国以北的荷属阿鲁巴岛的海上边境。但委内瑞拉与哥伦比亚边境仍处于关闭状态。艾萨米强调，这项决定源于这些邻国政府表现出对委内瑞拉主权的尊重。2月21日，委内瑞拉政府宣布关闭其与巴西边界，以防止主要来自美国的所谓“援助”物资经由巴西运入委内瑞拉。此外，委内瑞拉已关闭了与北部荷属三座岛屿的海上边境。
20190512_00,20190512,【壮丽70年 奋斗新时代】“两弹城”：穿越半个世纪的两弹精神,习近平总书记指出，长期以来，一代又一代科学家怀着深厚的爱国主义情怀，凭借深厚的学术造诣、宽广的科学视角，为祖国和人民作出了彪炳史册的重大贡献。在四川绵阳梓潼县，有一个叫“两弹城”的地方。这里曾经是我国最神秘的核武器研制基地之一。国家表彰的23位“两弹一星”功勋奖章获得者中，有9位先后在这里工作生活。今天（5月12日）的《壮丽70年 奋斗新时代》系列报道，我们一起走进这座神秘的“两弹城”，走近这群干惊天动地事的隐姓埋名人。位于四川省绵阳市梓潼县的这片院落，是中国工程物理研究院的旧址，现在被称为“两弹城”。许多人慕名而来，在这里，这些穿越时空的建筑，仿佛让大家走进了新中国核武器科技事业的艰难时期。然而二十几年前，这里还是一片常人不能涉足的禁地。在首颗原子弹试验成功后不久，1965年，党中央决定将核武器研制基地从青海迁至四川腹地这片远离城市的山区里。就在这样艰苦的条件下，一批当时全国最顶尖的科学家带领2万多名科技工作者扎根在这里。物理学家陈能宽院士1955年满怀爱国热情回国工作。辗转来到这座偏僻的“两弹城”后，他在奋斗中度过了12年的岁月。在给妻子的信中他说到：当年我们抛弃洋房轿车，带着女儿回国，正是为了干一番事业，让祖国富强。为了祖国富强的理想，这些科学家们舍弃的又岂止是优越的条件。在物理学家王淦昌曾经住过的宿舍里，记者找到了这样一个木箱，上面写着“王京”两个字。王京是谁？又代表着什么？在这隐姓埋名的17年里，连王淦昌的妻子都不清楚丈夫的去向，由于当时各个基地都是用信箱为代号，所以每当别人问起她，她就会说，老王到“信箱”里去了。在“两弹元勋”邓稼先位于“两弹城”的旧居里，有这样一张纸条，上面写着“我明天还要动一次小手术”，记者发现，这张纸条上的“小”字，明显是加上去的，邓稼先写下这张纸条时，正在忍受晚期直肠癌的折磨。在“两弹一星”功勋科学家们带领下，从1970年到1996年，“两弹城”先后指挥了数十次核试验，打造出一批守护祖国和平安宁的“国之利器”，也诞生了一批至今引领中国原始创新的科技工程。“干惊天动地事，做隐姓埋名人”，是这些科学家们无悔的人生选择。如今，新一代的科研工作者已经成为中国工程物理研究院的主力军，不管时代如何改变，铸国防基石，做民族脊梁，永远是“两弹城”里不变的使命和精神。
20190512_01,20190512,北方春耕季 田间亮点多,眼下正是北方春耕时节，今年各地一大批农业新科技在田间得到应用，一系列体现生态文明理念的农业新路子得到推广。黑龙江三江平原这几天正是水稻插秧的大忙时节。这片稻田里，往年的插秧机今年不见了，取而代之的是这个身材庞大、只用两名技术工人操作的“空中飞客”。这个无人机翼展有3.7米，随身携带了8个种箱，每个箱内装有1公斤水稻芽种，向下的排种导管杆好似一个个喷枪，直接将水稻芽种精准喷射到水面下0.5厘米的位置。利用无人机进行水稻航播作业，因为没有起苗、运苗、插秧环节，也就没有了对秧苗的二次伤害，播下的芽种5到7天就可以生根发芽。目前，靠着现代化机械作业，黑龙江玉米、水稻、大豆等实现了抢墒快播，玉米、大豆已完成播种，水稻插秧将在5月中旬结束，全省粮食播种面积稳定在2亿亩以上。新疆现在正是番茄的播种时间，全疆番茄种植面积大，全球每四瓶番茄酱就有一瓶产自新疆。在玛纳斯县，这3万亩番茄今年采用机械化移栽，既抢农时，又保成活率，一台移栽机每天可以移栽30亩，相当于15个人在干活。农技人员介绍，机械化移栽每亩产量可以提高1吨以上。吉林东辽县位于东辽河源头，今年春耕，当地一改往年有地就种庄稼的老办法，把4000多公顷农田改为水源涵养林，以林护水，也以林养田。新种植的柞树、沙棘等经济林，让村民由“粮农”变身为“树农”“蚕农”，也在当地形成新产业。配合水源涵养林种植，东辽县同时展开高标准农田建设，培育绿色农业生产体系。今年，在春季生产中大展身手的不光有无人机，还有田间机器人、智能农机具、卫星定位播种机等，全国预计有2200万台各类农机具投入春季农业生产，已播农作物超过3.5亿亩。
20190512_02,20190512,栗战书将访问挪威 奥地利和匈牙利,应挪威议长特罗恩、奥地利国民议会议长索博特卡和联邦议会议长阿佩、匈牙利国会主席克韦尔的邀请，全国人大常委会委员长栗战书将于5月15日至24日对挪威、奥地利和匈牙利进行正式友好访问。
20190512_03,20190512,中办 国办印发《国家生态文明试验区（海南）实施方案》,近日，中共中央办公厅、国务院办公厅印发了《国家生态文明试验区（海南）实施方案》，并发出通知，要求有关地区和部门结合实际认真贯彻落实。《国家生态文明试验区（海南）实施方案》提出，通过试验区建设，确保海南省生态环境质量只能更好、不能变差，人民群众对优良生态环境的获得感进一步增强。到2020年，试验区城镇空气质量优良天数比例保持在98%以上，细颗粒物（PM2.5)年均浓度不高于18微克/立方米并力争进一步下降；基本消除劣V类水体，主要河流湖库水质优良率在95%以上，近岸海域水生态环境质量优良率在98%以上；土壤生态环境质量总体保持稳定；水土流失率控制在5%以内，森林覆盖率稳定在62%以上，守住909万亩永久基本农田，湿地面积不低于480万亩，海南岛自然岸线保有率不低于60%；单位国内生产总值能耗比2015年下降10%，单位地区生产总值二氧化碳排放比2015年下降12%，清洁能源装机比重提高到50%以上。到2025年，生态文明制度更加完善，生态文明领域治理体系和治理能力现代化水平明显提高；生态环境质量继续保持全国领先水平。到2035年，生态环境质量和资源利用效率居于世界领先水平，海南成为展示美丽中国建设的靓丽名片。
20190512_04,20190512,人民日报评论员文章：中美开展经贸合作是正确的选择，但合作是有原则的,明天（5月13日）出版的人民日报将发表评论员文章，题目是《中美开展经贸合作是正确的选择，但合作是有原则的》。文章指出：对中美经贸磋商，中方始终高度重视，一直抱着极大的诚意，希望在平等相待、互相尊重的基础上，达成一份互利双赢的协议。然而，美方出尔反尔，进行极限施压，进一步给中国输美产品加征关税，给中美经贸谈判蒙上了阴影，直接导致磋商未果，责任完全在美方。文章强调，中美开展经贸合作是最好的选择，但合作是有原则的。中方在重大原则问题上决不让步，坚决捍卫国家核心利益和人民根本利益，任何时候都不会丧失国家尊严，任何人都不要指望中国会吞下损害自己核心利益的苦果。“合则两利，斗则俱伤”。希望美方能相向而行，抱着理性、务实的态度解决存在的问题，让中美经贸交往更好造福两国人民和世界人民。文章强调，越是形势复杂，挑战严峻，越要发挥党中央集中统一领导的定海神针作用。在以习近平同志为核心的党中央坚强领导下，保持战略定力，增强必胜信心，集中精力办好自己的事情，我们就能沉着应对各种风险挑战，战胜一切艰难险阻。
20190512_05,20190512,新华社评论员文章：无惧风雨，砥砺前行,新华社今天（5月12日）播发题为《无惧风雨，砥砺前行》的评论员文章。文章强调，只要我们自己有信心有底气，什么困难都不怕，什么坎都能迈过去。以习近平同志为核心的党中央的坚强领导、中国特色社会主义制度的优越性、全国人民的团结奋斗，是我们应对风险挑战的最大优势和根本保证。我们的信心，源于中国发展的深厚实力与巨大潜力。我们的底气，源于深化改革开放的坚定抉择。新时代的中国将坚定不移深化改革开放，坚定不移推动构建人类命运共同体，沉着冷静、淡定从容地砥砺前行。
20190512_06,20190512,【爱国情 奋斗者】谢彬蓉：大凉山上的“铿锵玫瑰”,今天（5月12日）的“爱国情奋斗者”我们要为大家介绍一位支教老师谢彬蓉。她曾在偏远地区当兵服役20年，退役后又到四川凉山当起了支教老师。5年来，谢彬蓉在海拔3000多米的讲台上，把一名退役老兵的家国情怀融进了大凉山的脱贫攻坚中。从西昌市出发到大凉山腹地的国家级贫困县美姑县，要翻越海拔2991米的黄茅埂山脉，这两年，大凉山的道路得到了很大改善，水泥路已经修到了村小学的门口。飘扬着五星红旗的地方，就是谢彬蓉支教的扎甘洛村小学。扎甘洛村有40多户，200多村民，但因为太贫穷太偏远，20多年间，村里始终没有固定老师，谢彬蓉是来村里的第17位支教教师。30年前，谢彬蓉考入四川师范大学，毕业时被部队特招入伍到内蒙古额济纳旗边远地区服役，并成长为空军某部的一名高级工程师。2013年，谢彬蓉退役回到了家乡重庆。一次偶然的机会，她从网上看到凉山需要支教教师，就报了名。2014年2月刚到扎甘洛村时，谢彬蓉的家就安置在这间教室里，最初的每个夜晚，她都难以入眠。扎甘洛村严重缺水，卫生条件极差，刚到没多久，她的一只眼睛就因重度感染而不得不进行手术。村民们以为谢老师肯定要离开了，可是大家没有想到，谢老师不仅每天坚持上课，还走遍了全村，把适龄的孩子拉回了课堂。班上30名学生，最小的8岁，最大的已经16岁，谢彬蓉就分类教学、逐个提升。她从孩子们最熟悉的玉米、土豆、核桃入手，教他们学会加减法。她还自编歌谣教孩子们认识拼音和汉字。几年下来，当年拖着鼻涕、灰头土脸的孩子们变得整洁、懂礼、自信了。凉山州开展脱贫攻坚以来，如今每天都在发生新变化，一条条水泥路通向各个村寨、一栋栋彝家新寨已拔地而起，目前，全州3100多个幼教点“学前学会普通话”行动已同步展开，通过教育让贫困不再代际相传，彝族群众的生活和精神面貌都正在发生变化。而这一切，也让谢彬蓉更加坚定了自己的凉山教育梦。
20190512_07,20190512,产教紧密融合 职教改革向纵深推进,本周是第五届全国职业教育活动周，国家职业教育改革方案的具体措施也陆续出台，把产教融合落到实处成为涉及最多的重点。在本届职业教育活动周，从技能大赛的赛项更新，到仿真教学、智慧车间等展示体验，企业参与力度明显提升。教育部日前发布落实国家职业教育改革方案的推进措施，其中，双师型队伍、混合所有制办学等新政策，将把企业主体地位真正落实。下一步，职校学生除了拿到学历证书，在校期间就能考取若干职业技能等级证书，这叫1+X证书制度。这一举措，参与政策制定的企业高级技师唐跃辉用一个“实”字来评价。新政策更加保障企业办学的地位和权益，在山东畜牧兽医职业学院，已经成立六个由企业占股90%的二级学院。在江苏，每年将扶持一百家产教融合型企业，加快落实税费抵扣等国家新政策。
20190512_08,20190512,各地开展活动提升灾害防治能力,今天（5月12日）是全国第十一个防灾减灾日。5月6日至12日期间，各地以“提高灾害防治能力，构建生命安全防线”为主题，广泛开展防灾减灾宣传周活动。大绳横渡，直升机索降，在河北邯郸举行的“2019抗洪抢险应急救援演练”中，11支专业救援队对孤岛营救、直升机救援等10个抗洪抢险救援科目进行了集中训练与展示。针对山区地质灾害多发的特点，四川、贵州等地集中开展跨区域地质灾害拉动演练，通过模拟实战，重点检验区域搜救、破拆营救等人员搜救科目的训练成果。各地应急救援部门还联合学校、企业等社会单位，开展了逃生疏散演练、危化品灭火救援演练等活动。此外，应急管理部、民政部等部门联合主办了全国首届社会应急力量技能竞赛，300多支社会抢险救援队伍参加比赛。
20190512_09,20190512,纪录片《亚洲 文明之光》今晚开播,由中央广播电视总台制作的三集亚洲文明对话大会主题纪录片《亚洲 文明之光》今晚（5月12日）起在央视综合频道、中文国际频道和中国国际电视台英语频道、阿拉伯语频道播出。中央广播电视总台充分运用全球采编体系支持，拍摄足迹遍及22个亚洲国家和地区，13个国内城市，通过选取亚洲文明最具标志性的元素，呈现多元共生的优秀文明成果。今晚（5月12日）播出第一集《文明华章》。
20190512_10,20190512,北方遭遇沙尘降温 南方将迎新一轮降雨,受冷空气影响，今天（5月12日），北方多地被大风沙尘天气笼罩，气温普遍下降。南方从昨天（5月11日）开始的降雨，明日（5月13日）将逐渐减弱，但预计下周又将迎来新一轮降雨。今天（5月12日），北方多地遭遇沙尘天气。陕西西安，早上九点半左右，沙尘逐步弥漫开来。不到一个小时，大雁塔就在镜头中若隐若现。甘肃兰州城区上空也被沙尘笼罩，地面上、建筑物上、汽车上落满细小的沙土。许多行人都用手紧紧捂住口鼻，匆匆前行。针对大风沙尘天气，气象部门提醒大家及时关闭门窗，出行携带口罩等防尘用品，并警惕高空坠物。在冷空气的影响下，今明（5月12、13日）两天，北方气温将普遍下降6～8℃，其中内蒙古局地降温可达10℃以上。今天（5月12日），南方降雨范围扩大，中东部大部地区都被雨水覆盖，预计明天南方雨势将逐渐减弱，但15日到18日，江淮、江南、华南及西南地区又将迎来中到大雨、局地暴雨。
