id,date,title,content
20190510_06,20190510,国办印发通报对2018年落实重大政策措施 真抓实干成效明显地方予以督查激励,国务院办公厅近日印发通报，对2018年落实打好三大攻坚战和实施乡村振兴战略、深化“放管服”改革、推进创新驱动发展、持续扩大内需、推进高水平开放、保障和改善民生等有关重大政策措施真抓实干、取得明显成效的24个省（区、市）、80个市（州）、120个县（市、区、旗）等予以督查激励，相应采取30项奖励支持措施。
20190510_07,20190510,人民日报评论员文章：为实现伟大梦想创造安全稳定环境——论学习贯彻习近平总书记全国公安工作会议重要讲话精神,明天（11日）出版的人民日报将发表评论员文章，题目是《为实现伟大梦想创造安全稳定环境：论学习贯彻习近平总书记全国公安工作会议重要讲话精神》。
20190510_08,20190510,【壮丽70年 奋斗新时代】云南独龙江：更好的日子还在后头,地处横断山脉的云南贡山独龙江乡，是独龙族的主要聚居地，这里森林覆盖率高达93%，珍稀动植物资源丰富。刚刚实现整族脱贫的独龙族，如今正依托自身优势，为更好的日子努力奋斗。在独龙江乡最北边的迪政当村村口，村民白忠平正在修建一间老式的独龙族木楞房，他打算扩建自家的农家乐。曾经与世隔绝的独龙江乡是“三江并流”世界自然遗产核心区之一，也是自驾和徒步游客的向往之地。2015年，白忠平开起了村里第一家农家乐，正干的风生水起，2017年10月，独龙江景区突然对外宣布：暂停开放两年。没了游客，白忠平的农家乐，每年就要损失一万多元的收入。景区为什么要关闭。同时，独龙江乡聘任了300多位村民为护林员，开始改造一条56公里长的主干道，厕所、旅游标识等相关设施也在提升。看好升级后的旅游前景，2018年白忠平和村里的两位贫困户合作，申请了扶贫资金与贷款，开始建设新的客栈。有了能挣钱的产业，独龙族群众的生活习惯发生了明显的变化。以前，往往要到中午才会下地干活，但现在早上六七点就起床了，八点就下地，一忙就是一整天。走访各个村寨，我们感知着独龙族的千年巨变。生活条件在改善，文明意识也在提高。在独龙江乡孔当村，我们发现村民的微信群里，有一个“每日一晒”活动。孔志强告诉我们，前几年虽然搬进了新房，但村民们还保留着原来的生活习惯，早上不叠被子，很少打扫卫生。驻村干部来了后，整理卧室、打扫客厅，一样样示范……评分最高的人家还会有洗衣粉等小奖品。
20190510_09,20190510,北京2022年冬奥会迎来倒计时1000天,今天（10日）是北京2022年冬奥会倒计时1000天。各项筹办工作正稳步推进，力求为世界呈现一届绿色、共享、开放、廉洁的冬奥会。冰雪项目国家集训队今天在北京举行誓师动员大会，为迎接北京2022年冬奥会开启夏季新的备战周期。这些运动员中，部分是夏季运动项目转为冬季运动项目的。冬奥会倒计时1000天之际，冬奥会北京赛区17项建设项目，目前已经开工14项，今年计划有2项完工。在国家速滑馆，这里正在进行屋面和设备管道安装。场馆的设计灵感源自速滑选手环形竞速，22条动感十足的冰丝带象征着选手们滑行的轨迹。到年底就可以看到冰丝带在奥林匹克公园绚丽登场了。作为2008年北京奥运会的标志性场馆，“水立方”目前正在变身为“冰立方”，并可进行冰上和水上项目的相互转换。在位于河北张家口赛区的国家越野滑雪中心，滑雪赛道已经完成了中期验收。预计今年6月底，技术楼主体结构完成。吉林北山四季越野滑雪场是国家队备战冬奥会的重要集训基地之一。这座山洞里改建扩建而成的滑雪场，5月中旬将迎来首批国家队队员。北京2022年冬奥会和冬残奥会吉祥物，自去年8月8日面向全球征集以来，共收到5816件设计方案，目前，评选出的10件入选方案正紧锣密鼓地进行深化设计。
20190510_10,20190510,2019年中国品牌日系列活动举行,2019年中国品牌日系列活动今天（10日）在上海启动，活动将深入展示 为中国品牌高质量发展做出突出贡献的自主品牌，向消费者推介国货精品。今年中国品牌日主题是“中国品牌，世界共享；加快品牌建设，引领高质量发展；聚焦国货精品，感受品牌魅力”。在今天举行的2019年中国品牌发展国际论坛上，超过1000名中外嘉宾，围绕“品牌建设推动高质量发展”和“中国品牌发展惠及世界人民生活”进行了交流。今天下午开始，13个自主品牌消费品体验区向观众开放。体验区布置了50个特色主题互动体验场景，来自轻工、纺织、汽车、电子信息等四大消费领域的200多家知名自主品牌企业集中展示精品，让消费者亲身感受国货精品的魅力。自2017年起，每年5月10日被设立为“中国品牌日”，今年的活动从5月10日至12日在上海展览中心举行。
20190510_11,20190510,中央广播电视总台品牌强国战略联盟成立,中央广播电视总台品牌强国战略联盟今天（10日）成立，同时启动中国品牌强国盛典。由中央广播电视总台发起的品牌强国战略联盟，涵盖国家部委、地方政府、品牌企业、高等院校、科研机构、行业协会，业界专家等，首期成员单位约1200家。联盟倡议，通过强强联合，汇聚社会各界力量，在新时代深入践行品牌强国战略，发挥品牌在助力经济转型以及企业高质量发展中的作用；中国品牌强国盛典将围绕“品牌强国”主题，进行年度品牌发布、展示中国品牌实力，推动中国品牌建设持续、健康、高水平发展。作为当今世界体量规模最大、业务形态最多、覆盖范围最广的综合性国际传媒航母，中央广播电视总台是中国品牌最重要的载体平台和展示窗口，也是最有影响力的品牌传播者和塑造者。总台将立足国家战略，发挥自身优势，推动中国制造向中国创造转变、中国速度向中国质量转变、中国产品向中国品牌转变。
20190510_12,20190510,【为了民族复兴·英雄烈士谱】死于革命死得光荣——陈毅安,今天（10日）的英雄烈士谱带您了解湖南湘阴的陈毅安，彭德怀曾亲笔为陈毅安题词：“生为人民生的伟大，死于革命死得光荣！”1905年出生的陈毅安，17岁加入中国社会主义青年团，后经毛泽东推荐加入中国共产党。1927年，陈毅安参加了秋收起义，后随部队到井冈山，参加创建井冈山革命根据地的斗争。1928年8月，红军主力离开井冈山去湘南，井冈山大本营留守兵力只有三十二团，湘赣敌军乘虚而入。陈毅安接到急报，带上两个连昼夜急行赶到黄洋界，指挥部队击溃敌军3次进攻，取得了黄洋界保卫战的胜利，书写了以两个连击退敌人四个团的辉煌篇章。1930年6月，陈毅安奉命任红八军第一纵队队长，协助彭德怀占领长沙全城。长沙被占领后，敌人进行反攻，为了掩护红军撤退，陈毅安不幸中弹牺牲，时年25岁。如今，陈毅安的家乡湖南湘阴县正全力开展农村人居环境整治，通过发展乡村旅游等特色产业，加快推进乡村振兴。2018年，湘阴县乡村旅游接待游客151.8万人次，综合收入13.4亿元，农村居民人均可支配收入达18400元。
20190510_13,20190510,国内联播快讯,2025年婴幼儿照护服务体系基本形成今天（10日）召开的国务院政策例行吹风会上，国家卫健委等部门介绍，将鼓励地方政府通过提供场地、财政补贴等政策措施，支持社会力量开展婴幼儿照护服务，到2025年，全国婴幼儿照护服务体系基本形成。年底前基本取消高速公路省界收费站在今天（10日）的国务院政策例行吹风会上，交通运输部介绍了《深化收费公路制度改革取消高速公路省界收费站实施方案》的有关情况，力争年底前基本取消全国高速公路省界收费站，实现不停车快捷收费。全国将投入1000亿元实施职业技能培训在今天（10日）的国务院政策例行吹风会上，人社部表示，将实施职业技能提升行动，从失业保险基金结余中拿出1000亿元，用于职工技能提升和转岗转业培训，三年内开展各类补贴性职业技能培训5000万人次以上。2019年农业全过程无人作业实验启动我国2019年农业全过程无人作业实验，近日在黑龙江北大荒农垦集团建三江分公司红卫农场启动，多种无人农机借助北斗卫星导航，以及传感器和控制器，实现了无人驾驶作业。今年农业全过程无人作业实验还将在江苏、重庆等10个省区展开。2019全球（青岛）创投风投大会召开2019全球（青岛）创投风投大会昨天（9日）召开。会上，青岛市发布了《打造创业投资风险投资中心若干政策措施》，并新设500亿科创母基金，为创投风投机构提供全方位资金支持。公安机关重拳打击非法集资等经济犯罪公安部今天（10日）通报了打击和防范非法集资等涉众型经济犯罪工作情况。2018年至今年第一季度，全国公安机关共立非法集资、传销等涉众型经济犯罪案件近1.9万起，涉案金额4100亿元。摧毁重大跨区域犯罪网络200余个。
20190510_14,20190510,文明交流互鉴让世界变得更美好,亚洲文明对话大会即将在北京开幕，这场以亚洲文明交流互鉴与命运共同体为主题的大会，受到亚洲各国及世界其他国家的高度关注，各方期待大会能为探索不同文明的相处之道搭建崭新平台。几天后，出身缅甸传统艺人世家的温莫乌将会来北京参加亚洲文明对话大会，表演舞蹈和缅甸戏曲等，展示本民族传统文化。中缅两国艺术交流有着悠久的历史，缅甸传统舞蹈中的一些元素与唐朝时期的中国舞蹈有着一定的渊源。在温莫乌看来，不同的文化必须通过彼此了解，取长补短，才能获得更好的发展。即将来北京参会的约旦前副首相萨米尔·哈巴什奈认为，亚洲文明对话大会是中国智慧与中国作为的体现。法国当代中国国际发展研究中心主任皮埃尔·皮卡尔认为，亚洲文明对话大会将搭建文明互学互鉴、共同发展的平台，人类文明将在对话中绽放更加夺目的光彩。举办亚洲文明对话大会，体现了中国对构建亚洲命运共同体和人类命运共同体、探索解决亚洲和世界面临问题的深邃思考和务实行动。
20190510_15,20190510,伊朗要求欧盟履行伊核协议内承诺,伊朗外长扎里夫9日表示，欧盟不应要求伊朗单方面遵守伊核协议，而是应该致力于继续按照协议履行对伊朗的承诺。扎里夫9日在社交媒体上表示，欧洲被美国欺凌了整整一年，却只会表示遗憾，欧盟应该继续履行伊核协议框架内对伊朗的承诺，包括将欧盟国家与伊朗的经贸往来正常化。欧盟与英法德称致力于维护伊核协议当天早些时候，欧盟外交和安全政策高级代表莫盖里尼与英法德三国外长发表声明表示，致力于维护和全面执行伊核协议，同时呼吁伊朗继续遵守协议。声明对美国重新启动对伊朗的制裁表示遗憾，称欧盟将着力于维护与伊朗的合法贸易。俄外交部谴责美国对伊朗制裁9日，俄罗斯外交部发表声明，谴责美国政府对伊朗铁、钢等产业进行制裁的行为，呼吁美国停止阻碍其他国家与伊朗政治经济合作的行动。美方近来不断强化对伊朗施压，逐步重启因伊核协议而终止的对伊制裁，同时宣布制裁伊朗的铁、钢、铝、铜等产业。伊朗8日宣布反制措施，称将中止履行伊核协议部分条款。
20190510_16,20190510,国际联播快讯,马杜罗：面对美破坏行动 委不会退缩委内瑞拉总统马杜罗9日在首都加拉加斯表示，美国蓄意破坏委内瑞拉政府的各项活动，包括对委内瑞拉实施经济封锁、扰乱委内瑞拉进口等。马杜罗表示，美方做法是犯罪，但委内瑞拉不会退缩。美国上月宣布了一系列对委内瑞拉的制裁措施，包括禁止委内瑞拉中央银行在5月17日之后以美元进行交易等。联合国专家表示，美国行为无视国家主权及与受制裁国家有贸易往来的第三国的权利，对世界和平与安全构成了威胁。巴黎圣母院周边土壤出现铅污染法国警方9日发表声明称，巴黎圣母院前的广场和周边道路出现铅污染，这些区域土壤样本中铅含量为每千克10-20克，比法国卫生部门规定的每千克0.3克的标准多出数十倍。不过法国方面表示，空气中的铅含量并没有超标。巴黎圣母院上月突发大火。据法国环保组织估计，大火燃烧时熔毁了约300吨的铅并形成铅尘。警方表示，经常前往巴黎圣母院相关区域的当地人应该勤洗手，附近居民也应用湿布擦拭房屋。莫斯科燃放焰火纪念卫国战争胜利日当地时间9日晚，俄罗斯首都莫斯科燃放焰火，纪念卫国战争胜利74周年。璀璨的焰火点亮了莫斯科的夜空。5月9日是俄罗斯卫国战争胜利日，俄罗斯当天举行了多种纪念活动。当天早些时候，俄罗斯还在莫斯科举行“不朽军团”游行。人们高举曾经参加卫国战争的亲人的照片或画像，纪念他们的伟大付出。俄罗斯总统普京也参加了游行。
20190511_00,20190511,中国经济新活力：原始创新激发培育新动能,习近平总书记指出，我们要引进和学习世界先进科技成果，更要走前人没有走过的路，努力在自主创新上大有作为。近年来，我国原始性技术创新能力得到了显著增长，基础研究、原始创新从实验室到市场的路径也越来越短。在新科技革命和产业变革蓄势待发的新形势下，创新打造的新动能正在塑造中国发展的新优势。作为广东省首批启动建设的实验室之一，深圳鹏城实验室是深圳原始创新领域的重点建设平台。成立才刚刚一年，这个平台现在就已经汇聚了18位院士，开展了20多项重大科研项目。一个先进的科研平台，有利于加快实现重大核心技术的突破，有利于抢占未来经济科技发展的先机。为此，曾经一个科研院所都没有的深圳，像鹏城实验室这样的基础研究机构，现在累计已有13家，建成各类创新载体2190家。从全国看，国家打造的北京怀柔、上海张江、安徽合肥综合性国家科学中心这些基地，与布局建设的6个国家研究中心、494个国家重点实验室、346个国家工程技术研究中心、32个国家临床医学研究中心已经形成梯次布局。夯实创新基础设施建设的硬件有了，通过改革激发科研人员积极性的软环境建设也在加快。这两天，俞书宏正在带领团队对一种防火防腐的生物质人工合成木材做最后的实验论证，这一科研成果有望成为我国仿生材料领域又一项重大突破。去年以来，关于人才评价、科研管理等政策不断出台，各地也陆续建立鼓励创新、宽容失败的容错机制，就是为了鼓励俞书宏他们这样的科研人员大胆探索、挑战未知。从机构、人才“软硬”两个方面入手，两端发力的同时，各地也越来越多的开始注重用市场的力量撬动原始创新。近日，全国首座以创新为主题的场馆安徽创新馆开馆，开馆当天，1561项科技成果转化与融资项目，被直接交到市场手中，让市场来推动“科技之花”变成“产业之果”。如今，北斗开启了全球化进程，我国卫星导航与位置服务产业产值已超3000亿元；如今，“墨子号”成功发射，让我国量子信息产业实现全球“领跑”。如今，大亚湾中微子项目成果，不仅实现光电倍增管的国产化，而且领跑世界反应堆中微子研究。中国基础研究国际影响力正在大幅提升，成果已开始“多点开花”。可以说，全方位推进基础研究、原始创新，正在全面提升中国经济的增长质量，令中国经济不惧风浪。来自科技部的数据显示，2018年，全国科技界强化关键核心技术攻关，强化创新能力建设，全社会研究与实验发展支出占GDP比重预计为2.15%，发明专利申请量和授权量居世界首位。在世界经济与科技竞争日趋激烈的大背景下，中国基础科学研究正在奋起直追，由原始创新引发的经济新动能，正在不断塑造中国发展的新优势。
20190511_01,20190511,李克强在企业减税降费专题座谈会上强调 让减税降费红利切实惠及企业 更大激发市场主体活力,10日，中共中央政治局常委、国务院总理李克强主持召开企业减税降费座谈会。中共中央政治局常委、国务院副总理韩正出席。会上，不同行业的9家企业负责人发了言，认为今年减税降费力度超出预期，是最直接、最有效、最公平的惠企措施，企业显著减负，也带动研发投入和就业增加。李克强说，更大规模减税降费是党中央、国务院重大决策，有力增强了市场信心。当前经济运行总体平稳，积极因素增加，但国际环境不确定因素也在增加，国内经济存在下行压力，既要坚定信心，又要正视困难。要以习近平新时代中国特色社会主义思想为指导，抓紧落实中央经济工作会议和《政府工作报告》部署，做好“六稳”工作，更有针对性地实施宏观调控，依靠改革开放激活力增动力，应对各种困难挑战，保持经济平稳运行。李克强说，更大规模减税降费是优化营商环境、激发市场活力的关键举措，有利于稳增长稳就业，还能促进企业加强创新、培育税源、增强后劲。这项工作已全面展开，要持续加快推进。减税降费是“一揽子”政策，要加强协同，系统推进降低增值税率、研发费用加计扣除、小微企业所得税优惠、个税改革和降低社保费率等政策，确保所有行业税负只减不增，企业社保缴费负担实质性下降。针对企业反映的问题攻坚克难。坚决防止乱收费，防止一些企业违背合同强制要求上游企业降价。李克强说，下一步还要出台更多深化改革开放、鼓励创业创新、促进公平竞争的措施。企业要把政策红利用于提升竞争力，推动高质量发展。胡春华、肖捷、何立峰参加。
20190511_02,20190511,【壮丽70年 奋斗新时代——推动高质量发展调研行】广西：舞动边海纽带  美景“串珠成链”,和东盟陆海相连的广西，把散落在边境上的景点、景区“串珠成链”，打造边海旅游风景 道，沉寂的西南边陲搭上了旅游发展的快车，也让边境群众脱贫致富。广西东兴市与越南芒街隔河相望，每天中越友谊大桥上人流如织。在这里，凭一张身份证就能来一场说走就走的跨境 一日游。其实早在1992年，东兴就已经开展一日或多日的中越跨境旅游业务，但由于办证手续繁琐、景点单一，并不红火。党的十八大以来，广西抓住东兴作为国家重点开发开放试验区的契机，改造提升东兴口岸、道路等基础设施，并先行 先试全国异地办证边境游业务，与越南广宁省合作推出了一张身份证出国一日游、“中越边关风情游”等多个跨境旅 游项目。去年6月，还开通了中国桂林-防城港(东兴)到越南芒街-下龙的自驾游线路。2018年，广西东兴口岸出入境人数达1219万人次，在全国陆路口岸仅次于深圳和珠海。为统筹边境地区旅游发展，广西决定投资160亿元以上，把一个个散落在陆路边境线和海岸线上的各个景区、景点“串 珠成链”，打造811公里长的边海国家旅游风景道。目前，已成功推出了9条跨国游、边关体验游等精品旅游线路。崇左德天瀑布与越南板约瀑布相连，是亚洲第一大跨国瀑布。广西联合越南高平省，在合作建设德天－板约瀑布旅游 合作区基础上，还串联起友谊关、靖西通灵大峡谷、防城港金滩、北海银滩等多个景点。连点成带，边海旅游崛起的同时，也鼓起了沿线百姓的腰包。中越边境上的靖西市念安屯原本是个贫困村。近年来， 依托建立起来的鹅泉旅游风景区，村民陆续兴办了36家农家乐，搞旅游、卖特产，全村人均年收入超过1万元。现在， 已有129户近500人摆脱了贫困。2018年，广西边海国家旅游风景道沿线的防城港、百色、崇左三地8个边境县(市)的旅游总消费约500亿元，同比增长 约30%，带动数万人脱贫致富。
20190511_03,20190511,天津：提供“应用场景”助人工智能落地,人工智能技术转化为现实生产力，需要“应用场景”做支撑，天津积极搭建“应用场景”，加快制造业的升级。这段近30公里的无人车开放测试道路，是由天津市工信局、交通运输委和公安局三部门联合选定的首批开放测试道路，并且为首批3辆“智能网联车”颁发了测试牌照。这样，无人车可以在真实道路上进行自动驾驶的仿真测试。今年，天津市还将西青区一处4000亩的散乱污工业园进行清理，建设专用的智能网联测试场，涉及越野、停车场、出入闸机口等上百种测试场景，支撑智能网联汽车的落地。在中新天津生态城，智慧公交车、无人清扫车、无人售卖餐厅等每天都有条不紊地运转；无人机也实时监控着城市交通、采集空气质量数据。这些应用场景，可以同时运行交通、环境、城管等42个智能管理系统。今年，天津市为了实现各部门数据信息共享，正式颁布实施《促进大数据发展应用条例》。天津还设立了百亿智能制造财政专项资金、千亿级新一代人工智能科技产业基金，带动一批智能机器人、智能硬件产品等加速落地，形成新的经济增长点。
20190511_04,20190511,浙江宁波：科技引领 助力高质量发展,浙江省宁波市通过打造技术转移平台、引进科研院所等方式，营造良好创新环境，以科技 引领创新，为高质量发展助力。这是浙江宁波科技大市场的一场项目对接会。台上，科研院所晒技术；台下，企业寻找合作伙伴，在宁波，这样热闹 的场面每半个月就有一次。宁波有12万家制造业民营企业。同时，大学和科研机构实力雄厚。2017年底，宁波市政府部门牵头成立科技大市场， 让科技成果转化有了可信赖的中介平台。宁波家联是一家生产全降解材料的企业，前几年行业竞争激烈。科技大市场促使企业与中科院成功牵手后，研发出全 降解材料发泡技术，企业因此成为全球首家运用这项技术实现量产的企业。2017年底，宁波市面向所有高校、科研院所和科技人员，整理汇编出了总共657条企业进一步发展的技术需求。去年一年，宁波科技大市场成功撮合了80对院企合作。良好的科技合作，推动宁波出现了28个全国制造业单项冠军企 业。有了单项冠军，宁波进一步打造千亿级现代产业集群。包括以绿色石化、汽车为代表的2个万亿级产业；以高端装备、 电子信息等4个5千亿级产业；以及生物医药、文化体育等6个千亿级现代产业集群。配合产业集群建设，宁波在引进高能级科研大院大所上下功夫。去年以来，就引进12家高能级大院大所，顶尖专家45 名。2018年，宁波地区生产总值突破万亿元，成为我国第15个地区生产总值过万亿的城市。
